{
  "adapters": {
    "longmemeval": {
      "card_license": "mit",
      "files": [
        {
          "bytes": 15388478,
          "path": "longmemeval_oracle.json",
          "sha256": "821a2034d219ab45846873dd14c14f12cfe7776e73527a483f9dac095d38620c"
        },
        {
          "bytes": 277383467,
          "path": "longmemeval_s_cleaned.json",
          "sha256": "d6f21ea9d60a0d56f34a05b609c79c88a451d2ae03597821ea3d5a9678c3a442"
        },
        {
          "bytes": 2737100077,
          "path": "longmemeval_m_cleaned.json",
          "sha256": "9d79e5524794a2e6900a3aa9cb7d9152c5a3e8319c9a87c25494ba1eacee495f"
        }
      ],
      "hf_repo": "xiaowu0162/longmemeval-cleaned",
      "redistribution": "unresolved",
      "revision": "98d7416c24c778c2fee6e6f3006e7a073259d48f",
      "status": "local_only",
      "upstream_provenance": "session data derived from ShareGPT/UltraChat-style public conversations; card license=mit is the publisher declaration only"
    },
    "miracl": {
      "card_license": "apache-2.0",
      "files": [
        {
          "bytes": 36782,
          "lang": "en",
          "path": "topics/dev.topics.jsonl",
          "split": "dev"
        },
        {
          "bytes": 34135,
          "lang": "en",
          "path": "topics/test-a.topics.jsonl",
          "split": "test-a"
        },
        {
          "bytes": 109792,
          "lang": "en",
          "path": "topics/test-b.topics.jsonl",
          "split": "test-b"
        },
        {
          "bytes": 167817,
          "lang": "en",
          "path": "qrels/dev.qrels.tsv",
          "split": "dev"
        },
        {
          "bytes": 50019,
          "lang": "ja",
          "path": "topics/dev.topics.jsonl",
          "split": "dev"
        },
        {
          "bytes": 38489,
          "lang": "ja",
          "path": "topics/test-a.topics.jsonl",
          "split": "test-a"
        },
        {
          "bytes": 66260,
          "lang": "ja",
          "path": "topics/test-b.topics.jsonl",
          "split": "test-b"
        },
        {
          "bytes": 160882,
          "lang": "ja",
          "path": "qrels/dev.qrels.tsv",
          "split": "dev"
        },
        {
          "bytes": 16903,
          "lang": "zh",
          "path": "topics/dev.topics.jsonl",
          "split": "dev"
        },
        {
          "bytes": 39712,
          "lang": "zh",
          "path": "topics/test-b.topics.jsonl",
          "split": "test-b"
        },
        {
          "bytes": 94140,
          "lang": "zh",
          "path": "qrels/dev.qrels.tsv",
          "split": "dev"
        }
      ],
      "hf_repo": "miracl/miracl",
      "redistribution": "not_run",
      "revision": "5be20db9509754dadad47689368639fcec739c00",
      "scope": "zh/ja/en monolingual; local-only adapter contract, not_run / not_comparable_to_official; no corpus download, no committed topics/qrels",
      "status": "adapter_only"
    },
    "nfcorpus": {
      "card_license": "cc-by-sa-4.0",
      "redistribution": "unresolved",
      "source": "https://public.ukp.informatik.tu-darmstadt.de/thakur/BEIR/datasets/nfcorpus.zip",
      "source_md5": "a89dba18a62ef92f7d323ec890a0d38d",
      "status": "local_only",
      "upstream_provenance": "BEIR wrapper cc-by-sa-4.0 (HF card); upstream NFCorpus research distribution license not closed"
    }
  },
  "cross_coverage_targets": {
    "cross_session": 10,
    "hard_negative": 34,
    "knowledge_update": 15,
    "long_chinese": 31,
    "same_name": 21,
    "session_filter": 15,
    "source_filter": 15,
    "time_filter": 6
  },
  "dataset": {
    "holdout_count": 48,
    "name": "shiori-phase4d-golden",
    "query_count": 120,
    "rows_jsonl": "golden_queries.jsonl",
    "schema_ref": "benchmark/corpus_schema.json",
    "tune_count": 72
  },
  "golden_queries": {
    "bucket_counts": {
      "duplicate": 10,
      "exact": 15,
      "filter": 15,
      "multi_turn": 15,
      "multilingual": 20,
      "no_evidence": 15,
      "paraphrase": 15,
      "temporal": 15
    },
    "split_counts": {
      "holdout": 48,
      "tune": 72
    }
  },
  "manifest_version": "1",
  "query_splits": [
    {
      "bucket": "exact",
      "evidence": {
        "hard_negative": {
          "non_relevant_docs": [
            "doc-0010"
          ],
          "relevant_docs": [
            "doc-0009"
          ],
          "why": "doc-0010 (freshness) is a later migration in the same db session; query asks for the manager-history migration"
        }
      },
      "query_id": "q-0001",
      "split": "tune",
      "tags": [
        "hard_negative"
      ]
    },
    {
      "bucket": "exact",
      "evidence": {
        "hard_negative": {
          "non_relevant_docs": [
            "doc-0011"
          ],
          "relevant_docs": [
            "doc-0010"
          ],
          "why": "doc-0011 (provenance) is a later migration; query asks for the freshness column"
        }
      },
      "query_id": "q-0002",
      "split": "tune",
      "tags": [
        "hard_negative"
      ]
    },
    {
      "bucket": "exact",
      "evidence": {
        "hard_negative": {
          "non_relevant_docs": [
            "doc-0010"
          ],
          "relevant_docs": [
            "doc-0011"
          ],
          "why": "doc-0010 (freshness) is an earlier migration in the same session; query asks for provenance"
        }
      },
      "query_id": "q-0003",
      "split": "tune",
      "tags": [
        "hard_negative"
      ]
    },
    {
      "bucket": "exact",
      "evidence": {},
      "query_id": "q-0004",
      "split": "tune",
      "tags": []
    },
    {
      "bucket": "exact",
      "evidence": {
        "hard_negative": {
          "non_relevant_docs": [
            "doc-0005"
          ],
          "relevant_docs": [
            "doc-0004"
          ],
          "why": "doc-0005 is the zh translation of the storage fact; the en query targets doc-0004"
        }
      },
      "query_id": "q-0005",
      "split": "tune",
      "tags": [
        "hard_negative"
      ]
    },
    {
      "bucket": "exact",
      "evidence": {
        "hard_negative": {
          "non_relevant_docs": [
            "doc-0007"
          ],
          "relevant_docs": [
            "doc-0006"
          ],
          "why": "doc-0007 is the zh MCP write-fact translation; the en query targets doc-0006"
        }
      },
      "query_id": "q-0006",
      "split": "tune",
      "tags": [
        "hard_negative"
      ]
    },
    {
      "bucket": "exact",
      "evidence": {
        "hard_negative": {
          "non_relevant_docs": [
            "doc-0001"
          ],
          "relevant_docs": [
            "doc-0022"
          ],
          "why": "doc-0001 (build checks) shares the build session but does not mention the dependency cache"
        }
      },
      "query_id": "q-0007",
      "split": "tune",
      "tags": [
        "hard_negative"
      ]
    },
    {
      "bucket": "exact",
      "evidence": {
        "hard_negative": {
          "non_relevant_docs": [
            "doc-0022"
          ],
          "relevant_docs": [
            "doc-0001"
          ],
          "why": "doc-0022 (dependency cache) shares the build session but does not list lint/typecheck/tests"
        }
      },
      "query_id": "q-0008",
      "split": "tune",
      "tags": [
        "hard_negative"
      ]
    },
    {
      "bucket": "exact",
      "evidence": {
        "knowledge_update": {
          "docs": [
            "doc-0015",
            "doc-0016"
          ],
          "why": "the deadline moved from end-of-August (doc-0015) to last-working-day-of-August (doc-0016); the answer is the UPDATED value"
        },
        "same_name": {
          "docs": [
            "doc-0015",
            "doc-0016"
          ],
          "entity": "quarterly-report-deadline",
          "why": "both plan docs refer to the quarterly report deadline entity"
        }
      },
      "query_id": "q-0009",
      "split": "tune",
      "tags": [
        "knowledge_update",
        "same_name"
      ]
    },
    {
      "bucket": "exact",
      "evidence": {},
      "query_id": "q-0010",
      "split": "holdout",
      "tags": []
    },
    {
      "bucket": "exact",
      "evidence": {},
      "query_id": "q-0011",
      "split": "holdout",
      "tags": []
    },
    {
      "bucket": "exact",
      "evidence": {
        "same_name": {
          "docs": [
            "doc-0017",
            "doc-0018",
            "doc-0021"
          ],
          "entity": "verified-release",
          "why": "all deploy docs describe the verified-release policy entity"
        }
      },
      "query_id": "q-0012",
      "split": "holdout",
      "tags": [
        "same_name"
      ]
    },
    {
      "bucket": "exact",
      "evidence": {
        "hard_negative": {
          "non_relevant_docs": [
            "doc-0001"
          ],
          "relevant_docs": [
            "doc-0002"
          ],
          "why": "doc-0001 is the en build doc; the zh query targets doc-0002"
        },
        "long_chinese": {
          "cjk_chars": 19,
          "why": "zh query with substantial CJK text"
        }
      },
      "query_id": "q-0013",
      "split": "holdout",
      "tags": [
        "hard_negative",
        "long_chinese"
      ]
    },
    {
      "bucket": "exact",
      "evidence": {
        "hard_negative": {
          "non_relevant_docs": [
            "doc-0012"
          ],
          "relevant_docs": [
            "doc-0013"
          ],
          "why": "doc-0012 is the en nav doc; the zh query targets doc-0013"
        },
        "long_chinese": {
          "cjk_chars": 15,
          "why": "zh query with substantial CJK text"
        }
      },
      "query_id": "q-0014",
      "split": "holdout",
      "tags": [
        "hard_negative",
        "long_chinese"
      ]
    },
    {
      "bucket": "exact",
      "evidence": {